{
  "schema_version": 1,
  "record_type": "released-recovery-acquisition",
  "statement_sha256": "aaaaaaaaaaaaaaaaaaaaaaaaaaaaaaaaaaaaaaaaaaaaaaaaaaaaaaaaaaaaaaaa",
  "publisher_fingerprint": "AAAAAAAAAAAAAAAAAAAAAAAAAAAAAAAAAAAAAAAA",
  "assets": {
    "recovery_image": {
      "sha256": "1111111111111111111111111111111111111111111111111111111111111111",
      "size_bytes": 4294967296
    },
    "recovery_manifest": {
      "sha256": "2222222222222222222222222222222222222222222222222222222222222222",
      "size_bytes": 4096
    },
    "recovery_candidate": {
      "sha256": "3333333333333333333333333333333333333333333333333333333333333333",
      "size_bytes": 4096
    },
    "release.json": {
      "sha256": "aaaaaaaaaaaaaaaaaaaaaaaaaaaaaaaaaaaaaaaaaaaaaaaaaaaaaaaaaaaaaaaa",
      "size_bytes": 4096
    },
    "release.sig": {
      "sha256": "5555555555555555555555555555555555555555555555555555555555555555",
      "size_bytes": 4096
    }
  },
  "qualified": false,
  "flash_authorized": false,
  "builder_ready": false,
  "baseline_ready": false
}
